<!ELEMENT restaurants (restaurant)+>
<!ELEMENT restaurant (id, imatge, categoria, nom, lloc, preu)>
<!ELEMENT id (#PCDATA)>
<!ELEMENT imatge (#PCDATA)>
<!ELEMENT categoria (#PCDATA)>
<!ELEMENT nom (#PCDATA)>
<!ELEMENT lloc (#PCDATA)>
<!ELEMENT preu (#PCDATA)>

<!ATTLIST restaurant idprod ID #REQUIRED>